{
  "schemaVersion": "1.0.0",
  "version": "engine-v2",
  "evaluatorContractVersion": "assessment-engine-v2",
  "evaluatorArtifactPath": "contracts/version-artifacts/bundles/assessment-engine-v2.bundle.mjs",
  "evaluatorArtifactDigest": "fc874ffc20ceb7356ef64a2cbb6ba6a4c08654302dbd84dcae62ed64b3c8b0fe",
  "evaluatorMethods": [
    "validateDerivedEvidence",
    "exactDerivationCandidates",
    "calculateDimension",
    "classifyAssessment",
    "expandEligibleDerivations",
    "buildAuthoritativeHistoryEvidenceIds",
    "authoritativeReasonEvidenceIds",
    "buildContextualizationCandidates",
    "classifyPublication",
    "evaluatePublicationFence",
    "requiresCommentRemoval"
  ],
  "replayRuntimeContractVersion": "replay-runtime-v1",
  "replayRuntimeArtifactPath": "contracts/version-artifacts/bundles/replay-runtime-v1.bundle.mjs",
  "replayRuntimeArtifactDigest": "2aa25390b554c9f05bd722eece37b8c68f94f2111d7f03d61817cf0ed61b6515",
  "replayRuntimeMethods": [
    "canonicalizeIJson",
    "canonicalDigest",
    "assertEffectiveInterval",
    "selectEffectiveVersion",
    "parseMergeSignalYaml"
  ],
  "runtimeArtifacts": {
    "contracts/version-artifacts/bundles/replay-runtime-v1.bundle.mjs": "2aa25390b554c9f05bd722eece37b8c68f94f2111d7f03d61817cf0ed61b6515",
    "contracts/version-artifacts/environments/replay-node22-v1.json": "2cd07352e0db21d46025000065558f111994bf2311e1cadf27ae07479bfa6e25"
  },
  "schemaArtifacts": {
    "contracts/assessment-engine-artifact.schema.json": "54c46c92cb42e3f913e2eb9823d5b33dd8ddecc2da59123ab4634a99e29933ee",
    "contracts/assessment-retention-state.schema.json": "b7dedad0a82ef8f9a293441979de670860a01fdfec739b2a24dc5db5c1722f6b",
    "contracts/comment-deletion-authority.schema.json": "eba8f5eb9dcf2ce82a32ca72a47883059c48812cb7b3228c38ac795947c3ca8c",
    "contracts/comment-inventory-observation.schema.json": "96af7f658bfd3ec2cd0d582655851f60f4da88e40930ac10f1b92652dad1816e",
    "contracts/comment-ownership-observation.schema.json": "1c0493745430dffedfb467432dd47e2a5bcd18a549bd911072990759cd2ee0e7",
    "contracts/comment-removal-state.schema.json": "ba18fcdd41d0182a399415c95ede3cfc477995e740bb9faf964880b1a52308fa",
    "contracts/contextualization-output.schema.json": "f436b62b1deedae25edc73b5296be5e7a2ba5e8c310977274233acbe15f7d350",
    "contracts/contextualization-request-envelope.schema.json": "374651f4550d54445154699fc749f1c1e50a0dc973e727b72abeedea208090b0",
    "contracts/contextualization-request-ledger-head.schema.json": "0ade0e9237b9dbddfd42d5f0344df25cd601a2a01e65aaea6b7d6ce2361201ea",
    "contracts/contextualization-request-ledger.schema.json": "0ef92e7188a83e693333ec8ab08ea0721fd11df8482abc54aa71a64858a5736b",
    "contracts/contextualization-request.schema.json": "c5497f0e5249ab4c5c0a4fbd180b2952a2d964f408412abaa9072317f1bbf3a0",
    "contracts/contextualization-response-envelope.schema.json": "c1e36738a8d269542cc9ef3acaee743c09de7ee5c4f0b9f134b75f4d940b3c48",
    "contracts/database-uniqueness-receipt.schema.json": "d9396bbdad95c436a57ccfe50e69d395538926459bff49edae133b0fca4d32c9",
    "contracts/detailed-report-authority.schema.json": "c5846c56a03b39d76ca9d34c40f97a26dfedab066c8029bc55470997889f0de5",
    "contracts/detailed-report-authorization.schema.json": "969a899199d99fe390fde4f63e219a8ccb4b8db543930c77811f610bd8d0097a",
    "contracts/detailed-report-nonce-consumption.schema.json": "2dff3cc27a0048e117fdffee4ce1fd2316a5bfce8813449f030c1c773b526210",
    "contracts/detailed-report-projection.schema.json": "b876f2f26a9cfda08f3cca430651dede0b8e2ab009260ad224a8115376c2b980",
    "contracts/dimension-scoring-policy.schema.json": "16067850857c99803eb0df06f9e278cb4ad702831ce9da0e6b1be9aeedabf0e1",
    "contracts/evidence-artifact.schema.json": "9e8ee55072571dd2ee3e8f16f1d51495ca753cdab107694c924986d047b7a12a",
    "contracts/evidence-payload.schema.json": "0e9f8b54b9d1ab99a560fffd532498012b2b6fb18ac6a4efe4fd6180c461af35",
    "contracts/evidence-snapshot-manifest.schema.json": "a9849fa0563462db8ad6c994957ca4cfcde0af0941303b2b991d2e7e477f7035",
    "contracts/evidence-types.schema.json": "902c477a60df8c73c3bdb6a5f4928329c049c48e5a2cfe360d429eba2b04e50a",
    "contracts/feature-policy-artifact.schema.json": "a5ba9e01031044d00e8351dc1ab2d0a74a9ff1dee1f8ea669a7d4a5b9fa2a931",
    "contracts/github-app-identity-observation.schema.json": "5adc832f9639f1716876d6ca29d4d19b6355e5ced626d4c18f4d56bf8843d27f",
    "contracts/judgment-traceability.schema.json": "0fb0b343d5347891514ad946e2409e37e0ba0e8729c67fe790e69bcb4d3213f4",
    "contracts/lifecycle-stream-head.schema.json": "ba3e5799f6844624f6237872495737abb030594e8ff88e6cbccb6e736b9a2d31",
    "contracts/model-config-artifact.schema.json": "3c3213472e89ccaf38c2e22a5a423175ad16a3445abf50f0d8b126feb13da030",
    "contracts/phase0-cases.schema.json": "0ae0d9db681ef86759f04e9cc1a4a7426d9208b50f3665bde38f314e8f37ca63",
    "contracts/pr-comment-render.schema.json": "c936939983f5c77ba7e828f7d469d61a08968a1b614ef348a513c153866e7409",
    "contracts/pr-output-cursor-head.schema.json": "93e6a385ab57d731289fbed6a76fc64025f7db44eeeda51fa179b973992e1fb2",
    "contracts/pr-output-cursor.schema.json": "4efca0947976d015dad7a444ac84e8918bb01936066f4477307408c5b54f4fba",
    "contracts/pr-output-mutation-lease.schema.json": "dcdfa2096fc5a867dfea6948238b7ee6bf9ebb61f2cf406e8fa5a5d07a69863b",
    "contracts/product-policy-artifact.schema.json": "852b07e28462a1d867636b3a886229a79ae99098746adca8871bc2d61f74c8f6",
    "contracts/publication-state.schema.json": "b9072b80283a171e8fdfba5bc4bc8326ffcc78c1d5d3bf76f0c0e8d37632a082",
    "contracts/reason-code.schema.json": "62fbf73e344c5483f2ca24c1c94a5e373ef9f1f3725992f1c54d2d0bcb603ec5",
    "contracts/reason-codes.registry.schema.json": "e26e4f0df0ca564055fb8c4f0d788f82e46dd185fc0e083b39e3d6f0538dd350",
    "contracts/reputation-assessment.schema.json": "0a5624c52e81895ee98f2f6aff40d1a036c6a4511d5ebe11ed42609b6453c1cd",
    "contracts/routing-policy-artifact.schema.json": "364e3e8bb02c4ad27abbdef30de15cd56e60b5aee5c7b52b95ca0aef4531eded",
    "contracts/source-visibility-validation.schema.json": "da59256b88b279ed4cca3ef580dcde8246214685757a38e9e487a2003d32fa98",
    "contracts/version-registry.schema.json": "6265483a8c77f2c6140591870ffa07e24fa778f5988c3dbf69f955dd9a6b64ea",
    "contracts/evidence-types.json": "04034a5eeadb362e1e91c027fc959555ec7f84cbbdbc66e2fe37e149fab092dc",
    "contracts/reason-codes.json": "5978376c9eb157f53dfff9d299145694da5dbba5b84a3b0dcf1c8c733d8fa954"
  },
  "runtimeEnvironmentArtifactPath": "contracts/version-artifacts/environments/replay-node22-v1.json",
  "runtimeEnvironmentArtifactDigest": "2cd07352e0db21d46025000065558f111994bf2311e1cadf27ae07479bfa6e25"
}
